,Name,URLs,Description
40,Indonesia Database for Policy and Economic Research,https://databank.worldbank.org/source/indonesia-database-for-policy-and-economic-research/preview/on,"Indonesia Database for Policy and Economic ResearchPublic  The Indonesia Database for Policy and Economic Research (INDO-DAPOER) contains over 200 province- and district-level indicators which span across four main categories: fiscal, economic, social and demographic, as well as infrastructure.   ,  , Last Updated:08/11/2022"
41,Subnational Malnutrition,https://databank.worldbank.org/source/subnational-malnutrition/preview/on,"Subnational MalnutritionPublic  Subnational estimates of child malnutrition (prevalence for stunting, underweight, overweight, wasting and severe wasting indicators).  ,  , Last Updated:03/21/2016"
42,LAC EQUITY LAB,https://databank.worldbank.org/source/lac-equity-lab-/preview/on,"LAC EQUITY LAB Public  Poverty, shared prosperity, and equity indicators for LAC  ,  , Last Updated:04/06/2016"
43,India Power Sector Review Database,https://databank.worldbank.org/source/india-power-sector-review-database/preview/on,"India Power Sector Review DatabasePublic  This database underpins the analysis in the report “More Power to India: The Challenge of Electricity Distribution”. The database is a collection of primary and secondary data on the Indian power sector, collected at the utility and state levels. It covers 87 power utilities and 29 states and spreads over the years 2003 to 2011 across dimensions such as operational and financial performance, market structure, implementation of reforms and corporate and regulatory governance.    ,  , Last Updated:06/20/2014"
44,Country Partnership Strategy for India (FY2013-17),https://databank.worldbank.org/source/country-partnership-strategy-for-india-(fy2013^17)/preview/on,"Country Partnership Strategy for India (FY2013-17)Public  A selection of Indian sub-national (state) indicators on economic and social sectors relevant to the World Bank Group Country Partnership Strategy for India for the period 2013-2017. It is a compilation of data from official national sources that highlight the development challenges the World Bank Group in partnership with the Government of India, aims to address through its financing and knowledge program.  See also http://openindia.worldbankgroup.org   ,  , Last Updated:05/22/2015"
45,Agriculture in Africa – Telling Facts from Myths,https://databank.worldbank.org/source/agriculture-in-africa-–-telling-facts-from-myths/preview/on,"Agriculture in Africa – Telling Facts from MythsPublic  Indicators derived on the ""Agriculture in Africa – Telling Facts from Myths"" project  ,  , Last Updated:08/15/2014"
46,National Poverty Line - Subnational Poverty,https://databank.worldbank.org/source/national-poverty-line-^-subnational-poverty/preview/on,"National Poverty Line - Subnational PovertyPublic  Poverty data at the administrative unit level 1, based on national poverty line(s). Administrative unit level 1 refers to the highest subnational unit level (examples include ‘state’, ‘governorate’, ‘province’)  ,  , Last Updated:04/27/2015"
47,Quarterly External Debt Statistics GDDS,https://databank.worldbank.org/source/quarterly-external-debt-statistics-gdds/preview/on,"Quarterly External Debt Statistics GDDSPublic  In October 2014, the World Bank launched the new Quarterly External Debt Statistics (QEDS) GDDS database consistent with the classifications and definitions of the 2013 External Debt Statistics: Guide for Compilers and Users (2013 EDS Guide) and Sixth Edition of Balance of Payments and International Investment Position Manual (BPM6). The QEDS GDDS database provides external debt data, starting from 2002Q4, for an extension of countries that participate in the IMF's General Data Dissemination System (GDDS).  ,  , Last Updated:01/17/2025"
48,Quarterly External Debt Statistics SDDS,https://databank.worldbank.org/source/quarterly-external-debt-statistics-sdds/preview/on,"Quarterly External Debt Statistics SDDSPublic  In October 2014, the World Bank launched the new Quarterly External Debt Statistics (QEDS) SDDS database consistent with the classifications and definitions of the 2013 External Debt Statistics: Guide for Compilers and Users (2013 EDS Guide) and Sixth Edition of Balance of Payments and International Investment Position Manual (BPM6). The QEDS SDDS database provides detailed external debt data starting from 1998Q1. Data are published individually by countries that subscribe to the IMF’s Special Data Dissemination Standard (SDDS), as well as, GDDS participating countries that are in a position to produce the external debt data prescribed by the SDDS.  ,  , Last Updated:01/17/2025"
49,WDI Database Archives,https://databank.worldbank.org/source/wdi-database-archives/preview/on,"WDI Database ArchivesPublic  The WDI Database Archives (WDI-DA) contains previous versions of the World Development Indicators database, including indicators that have been discontinued. Data are drawn from all available electronic releases going back to 1989. Users should exercise caution when comparing data from different versions, as the same codes have been used to reference series with different base years or different valuations of a country's local currency. For example, the series code for constant US dollar GDP (NY.GDP.MKTP.KD), which is currently based in 2015, has been used in previous editions when the base year was 1987, 1995, 2000, 2005, and 2010. Please note that when an indicator is available in the WDI Archives and in the current WDI database, only the current metadata for this indicator is available in both databases. We will be working to improve the usability of the archives by harmonizing codes and names to the extent possible and adding additional metadata.  ,Archives,  ,Archives, Last Updated:08/10/2023"
50,Subnational Population,https://databank.worldbank.org/source/subnational-population/preview/on,"Subnational PopulationPublic  Subnational Population Database presents estimated population at the first administrative level below the national level. Many of the data come from the country’s national statistical offices. Other data come from the NASA Socioeconomic Data and Applications Center (SEDAC)  managed by the Center for International Earth Science Information Network (CIESIN) , Earth Institute, Columbia University. It is the World Bank Group’s first subnational population database at a global level and there are data limitations. Series metadata includes methodology and the assumptions made.  ,  , Last Updated:09/21/2017"
51,Sustainable Development Goals (SDGs),https://databank.worldbank.org/source/sustainable-development-goals-(sdgs)/preview/on,"Sustainable Development Goals (SDGs)Public  Relevant indicators drawn from the World Development Indicators, reorganized according to the goals and targets of the Sustainable Development Goals (SDGs). These indicators may help to monitor SDGs, but they are not always the official indicators for SDG monitoring.  ,SDGS,  ,SDGS, Last Updated:07/22/2022"
52,International Comparison Program (ICP) 2011,https://databank.worldbank.org/source/international-comparison-program-(icp)-2011/preview/on,"International Comparison Program (ICP) 2011Public  A set of comparable international price and volume measures of gross domestic products (GDP) and expenditure aggregates for 199 countries that participated in the 2011 round of International Comparison Program (ICP) and estimates for 15 non-participating countries. The data covers 26 expenditures categories for goods and services, and several indicators including purchasing power parities (PPPs), expenditure shares of GDP, total and per capita expenditures in US dollar both in exchange rate terms and PPP terms, and price level Indices. For further information see http://www.worldbank.org/en/programs/icp  ,GDP, PPP,  ,GDP, PPP, Last Updated:08/24/2020"
53,Wealth Accounts,https://databank.worldbank.org/source/wealth-accounts/preview/on,"Wealth AccountsPublic  Total wealth encompasses produced capital, renewable natural capital, nonrenewable natural capital, human capital, and net foreign assets. The construction of the wealth accounts is guided by the concepts and methods of the System of National Accounts (SNA), the handbook developed by the UN Statistical Commission used by virtually all countries to compile their national economic accounts. While values for produced capital and net foreign assets are generally derived from widely used methods based on observed transactions for these assets, the value of natural capital and human capital must be estimated. The approach to asset valuation is based on the concept that the value of an asset should equal the discounted stream of expected net earnings (resource rents or wages) that it earns over its lifetime.  ,  , Last Updated:10/08/2024"
54,Economic Fitness,https://databank.worldbank.org/source/economic-fitness/preview/on,"Economic FitnessPublic  Economic Fitness (EF) is both a measure of a country’s diversification and ability to produce complex goods on a globally competitive basis.  Countries with the highest levels of EF have capabilities to produce a diverse portfolio of products, ability to upgrade into ever-increasing complex goods, tend to have more predictable long-term growth, and to attain good competitive position relative to other countries.   Countries with low EF levels tend to suffer from poverty, low capabilities, less predictable growth, low value-addition, and trouble upgrading and diversifying faster than other countries. The comparison of the Fitness to the GDP reveals hidden information for the development and the growth of the countries.  ,  , Last Updated:04/19/2018"
55,Africa Infrastructure: Airport,https://databank.worldbank.org/source/africa-infrastructure:-airport/preview/on,"Africa Infrastructure: AirportPublic  Africa Infrastructure: Airport  ,Infrastructure, Airport,  ,Infrastructure, Airport, Last Updated:12/09/2009"
56,Africa Infrastructure: WSS Utility,https://databank.worldbank.org/source/africa-infrastructure:-wss-utility/preview/on,"Africa Infrastructure: WSS UtilityPublic  Africa Infrastructure: WSS Utility  ,Utility, Urban Development,  ,Utility, Urban Development, Last Updated:12/09/2009"
57,Africa Infrastructure: Electricity,https://databank.worldbank.org/source/africa-infrastructure:-electricity/preview/on,"Africa Infrastructure: ElectricityPublic  Africa Infrastructure: Electricity  ,Electricity, Urban Development,  ,Electricity, Urban Development, Last Updated:12/09/2009"
58,Africa Infrastructure: Ports,https://databank.worldbank.org/source/africa-infrastructure:-ports/preview/on,"Africa Infrastructure: PortsPublic  Africa Infrastructure: Ports  ,Ports Data, Trade Data,  ,Ports Data, Trade Data, Last Updated:07/31/2023"
59,Africa Infrastructure: National Data,https://databank.worldbank.org/source/africa-infrastructure:-national-data/preview/on,"Africa Infrastructure: National DataPublic  Africa Infrastructure: National Data  ,National Data, Urban Development, Social Development,  ,National Data, Urban Development, Social Development, Last Updated:12/09/2009"
60,Africa Infrastructure: Railways,https://databank.worldbank.org/source/africa-infrastructure:-railways/preview/on,"Africa Infrastructure: RailwaysPublic  Africa Infrastructure: Railways  ,Railways, Infrastructure,  ,Railways, Infrastructure, Last Updated:12/09/2009"
61,Africa Development Entrepreneurship,https://databank.worldbank.org/source/africa-development-entrepreneurship/preview/on,"Africa Development EntrepreneurshipPublic  Listening to Africa and Harmonized Household Survey Project  ,  , Last Updated:01/03/2017"
62,Remittance Prices Worldwide (Sending Countries),https://databank.worldbank.org/source/remittance-prices-worldwide-(sending-countries)/preview/on,"Remittance Prices Worldwide (Sending Countries)Public  Provides data on the cost of sending and receiving relatively small amounts of money from one country to another. Data cover 365 country corridors worldwide, from 48 remittance sending countries to 105 receiving countries.  ,  , Last Updated:12/07/2020"
63,Remittance Prices Worldwide (Corridors),https://databank.worldbank.org/source/remittance-prices-worldwide-(corridors)/preview/on,"Remittance Prices Worldwide (Corridors)Public  Provides data on the cost of sending and receiving relatively small amounts of money from one country to another. Data cover 365 country corridors worldwide, from 48 remittance sending countries to 105 receiving countries.  ,  , Last Updated:12/07/2020"
64,Remittance Prices Worldwide (Receiving Countries),https://databank.worldbank.org/source/remittance-prices-worldwide-(receiving-countries)/preview/on,"Remittance Prices Worldwide (Receiving Countries)Public  Provides data on the cost of sending and receiving relatively small amounts of money from one country to another. Data cover 365 country corridors worldwide, from 48 remittance sending countries to 105 receiving countries.  ,  , Last Updated:12/07/2020"
65,Sustainable Mobility for All,https://databank.worldbank.org/source/sustainable-mobility-for-all/preview/on,"Sustainable Mobility for AllPublic  Sustainable Mobility for All  ,  , Last Updated:"
66,PPPs Regulatory Quality,https://databank.worldbank.org/source/ppps-regulatory-quality/preview/on,"PPPs Regulatory QualityPublic  Procuring Infrastructure PPPs: Adherence to Best Regulatory Practices is a collection of comparable and actionable data on the procurement of large-scale public-private partnership (PPP) infrastructure projects around the world. The assessments of countries’ regulatory practices are organized in four thematic areas: preparation, procurement, contract management, and a special module on unsolicited proposals (USP).  ,  , Last Updated:04/25/2019"
67,Human Capital Index,https://databank.worldbank.org/source/human-capital-index/preview/on,"Human Capital IndexPublic  This dataset is classified as Public under the Access to Information Classification Policy. Users inside and outside the Bank can access this dataset. The Human Capital Index (HCI) database provides data at the country level for each of the components of the Human Capital Index as well as for the overall index, disaggregated by gender. The index measures the amount of human capital that a child born today can expect to attain by age 18, given the risks to poor health and poor education that prevail in the country where the child lives. It is designed to highlight how improvements in current health and education outcomes shape the productivity of the next generation of workers, assuming that children born today experience over the next 18 years the educational opportunities and health risks that children in this age range currently face.  ,  , Last Updated:09/21/2020"
68,Worldwide Bureaucracy Indicators (WWBI),https://databank.worldbank.org/source/worldwide-bureaucracy-indicators-(wwbi)/preview/on,"Worldwide Bureaucracy Indicators (WWBI)Public  Worldwide Bureaucracy Indicators (WWBI): A dataset on public sector employment and wages that can help researchers and development practitioners gain a better understanding of the personnel dimensions of state capability, the footprint of the public sector on the overall labor market, and the fiscal implications of the government wage bill.   ,  , Last Updated:09/20/2022"
69,Logistics Performance Index (LPI),https://databank.worldbank.org/source/logistics-performance-index-(lpi)/preview/on,"Logistics Performance Index (LPI)Public  Logistics Performance Index (LPI) - Logistics comprises a network of services that supports the physical movement of goods within and across borders.  It is a $4.3 trillion industry.  The 2018 Logistics Performance Index (LPI) scores countries on how efficiently they move goods across and within borders.  The LPI is an interactive benchmarking tool created to help countries identify the challenges and opportunities they face in their performance on trade logistics and what they can do to improve their performance.  The LPI 2018 allows for comparisons across 160 countries.  ,  , Last Updated:03/26/2024"
70,Health Equity and Financial Protection Indicators (HEFPI),https://databank.worldbank.org/source/health-equity-and-financial-protection-indicators-(hefpi)/preview/on,"Health Equity and Financial Protection Indicators (HEFPI)Public  Health Equity and Financial Protection Indicators (HEFPI) - The HEFPI database draws on data from over 1,600 household surveys, including the Demographic and Health Survey and the Multiple Indicator Cluster Survey. Most of the 1,600 surveys have been re-analyzed in-house to ensure comparability across surveys and years, since published indicators from different surveys often use different definitions. We have settled on a definition based on recommendations in the relevant literature, and have used that across all surveys and time periods. As a result, the numbers in HEFPI are often different from (and more comparable than) numbers published elsewhere.  HEFPI provides data on equity in the delivery of health service interventions and health outcomes, and on financial protection in health.  ,  , Last Updated:11/06/2019"
71,Global Financial Inclusion and Consumer Protection Survey,https://databank.worldbank.org/source/global-financial-inclusion-and-consumer-protection-survey/preview/on,"Global Financial Inclusion and Consumer Protection SurveyPublic  Global Financial Inclusion and Consumer Protection Survey  ,  , Last Updated:06/27/2019"
72,Economic Fitness 2,https://databank.worldbank.org/source/economic-fitness-2/preview/on,"Economic Fitness 2Public  Economic Fitness (EF) 2 is the second version of Economic Fitness, including the Universal Economic Fitness (UEF) which is both a measure of a country’s diversification and ability to produce complex goods on a globally competitive basis.  ,  , Last Updated:11/30/2024"
73,Environment Social and Governance (ESG) Data,https://databank.worldbank.org/source/environment-social-and-governance-(esg)-data/preview/on,"Environment Social and Governance (ESG) DataPublic  Aggregate groups may reflect economies beyond those included in this database. For details on the member composition, see World Bank Country and Lending Groups at https://datahelpdesk.worldbank.org/knowledgebase/articles/906519-world-bank-country-and-lending-groups  The ESG dataset provides a collection of indicators for sustainable investment analysis, based on a draft framework of 17 key sustainability criteria. The indicators are drawn from multiple World Bank databases and external data providers.  ,  , Last Updated:04/16/2024"
74,MIX Market,https://databank.worldbank.org/source/mix-market/preview/on,"MIX MarketPublic  MIX Market Data  ,  , Last Updated:10/03/2024"
75,ICP 2017,https://databank.worldbank.org/source/icp-2017/preview/on,"ICP 2017Public  Results from the International Comparison Program (ICP) 2017 cycle include data for the new reference year 2017, revised data for the previous reference year 2011, and annual purchasing power parities (PPPs) for 2012 to 2016. 2017 results are available for 176 participating economies and their aggregate regions. They cover 44 expenditure headings and provide several indicators for each heading, including PPPs, national accounts expenditures in PPP and nominal terms, and price level indices. Imputed results are available for an additional 12 economies that did not participate in the ICP 2017 cycle. Revised 2011 results are available for 179 participating economies and cover 44 expenditure headings and several indicators, including PPPs, national accounts expenditures in PPP and nominal terms, and price level indices. Additionally, partial results are available for 20 Pacific islands, while imputed results are available for 15 economies that did not participate in the ICP 2011 cycle. Annual PPPs are available for 2011 to 2017 and cover 6 major expenditure headings.  ,  , Last Updated:10/21/2020"
76,Gender Disaggregated Labor Database (GDLD),https://databank.worldbank.org/source/gender-disaggregated-labor-database-(gdld)/preview/on,"Gender Disaggregated Labor Database (GDLD)Public  Gender Disaggregated Labor Database (GDLD)  ,  , Last Updated:07/25/2020"
77,International Debt Statistics: DSSI,https://databank.worldbank.org/source/international-debt-statistics:-dssi/preview/on,"International Debt Statistics: DSSIPublic  IDS-DSSI is a supplemental database to the International Debt Statistics database and provides further disaggregation of external debt data including projected debt service payments for 2022 to 2024 presented on an annual and monthly basis where undrawn amounts are not projected.  ,  , Last Updated:12/03/2024"
78,Global Public Procurement,https://databank.worldbank.org/source/global-public-procurement/preview/on,"Global Public ProcurementPublic  Contains data about global procurement  ,  , Last Updated:03/24/2021"
79,Statistical Performance Indicators (SPI),https://databank.worldbank.org/source/statistical-performance-indicators-(spi)/preview/on,"Statistical Performance Indicators (SPI)Public  This dataset is classified as Public under the Access to Information Classification Policy. Users inside and outside the Bank can access this dataset.  The Statistical Performance Indicators (SPI) is a framework to measure progress in statistical capacity building and related investments. It covers five aspects: data use, data services, data products, data sources, and data infrastructure.  Countries will be given an opportunity to dispute the values that make up our indicators. The team takes every effort to make sure the data presented in the Statistical Performance Indicators are accurate, but it is possible that the sources we used to assign values for our indicators are occasionally not up to date or accurate despite these efforts. Because of this, countries will have a window to provide documentation for any disputed values through contacting the Bank directly or via data@worldbank.org. ""  ,  , Last Updated:11/11/2024"
80,Education Policy,https://databank.worldbank.org/source/education-policy/preview/on,"Education PolicyPublic  education policy  ,  , Last Updated:10/03/2024"
